paper,locus_id,rsid,nearest_gene_label,author_explanation_status,author_explanation_quote,pvalue,population,resolved_gene_bulk
Ang2023,chr4 ~1.7 Mb shared homozygous albino segment (co-segregating passengers),"rs463373 (representative); also rs3733437, rs6826912, rs439757, rs223495, rs3733632",EMCN / PPP3CA / SLC39A8 / MANBA / TACR3 (chr4 segment members),nearest_gene_only,All three albino individuals share a homozygous segment of ~1.7 Mb that encompasses several genes in addition to OCA2,,"Kalinago (Dominica); admixed ~55% Native American, ~32% Afri",
Ang2023,chr10 LRMDA co-segregating homozygous candidate (rs7911113),rs7911113,LRMDA,nearest_gene_only,All three albino individuals share a homozygous segment of ~1.7 Mb that encompasses several genes in addition to OCA2,,"Kalinago (Dominica); admixed ~55% Native American, ~32% Afri",LRMDA
Ang2023,"SYT6 locus, chr1 ~114.5-114.6 Mb (~20 SNPs collapsed to representative)","rs116218201 (representative); cluster also rs113236485, rs115102845, rs185469828",SYT6 (near/downstream/intronic),stated_unknown,our interpretation is that none of these variants warrant further investigation. Low observed minor allele frequencies (<2%) are inconsistent with those expected for variants responsible for pigmentation differences,P_adj=1.24E-07 (P_raw=1.12E-09),"Kalinago (Dominica); admixed ~55% Native American, ~32% Afri",
Ang2023,"KALRN locus, chr3:124343256 (rs676091)",rs676091,KALRN (intronic),stated_unknown,our interpretation is that none of these variants warrant further investigation. Low observed minor allele frequencies (<2%) are inconsistent,P_adj=1.78E-06 (P_raw=3.60E-08),"Kalinago (Dominica); admixed ~55% Native American, ~32% Afri",
Ang2023,"LOC107986284 locus, chr4:65768709 (rs6816819)",rs6816819,LOC107986284 (intronic),stated_unknown,our interpretation is that none of these variants warrant further investigation. Low observed minor allele frequencies (<2%) are inconsistent,P_adj=7.84E-08 (P_raw=6.11E-10),"Kalinago (Dominica); admixed ~55% Native American, ~32% Afri",TECRL
Ang2023,"POMC/EFR3B region, chr2:25329016 (rs12233134)",rs12233134,EFR3B (near POMC),nearest_gene_only,"0.348 - - 0.473 IMP; BETA_a=0.61, P_adj=0.2653 (no coding prediction; not significant)",P_adj=0.2653,"Kalinago (Dominica); admixed ~55% Native American, ~32% Afri",
Ang2023,"IRF4 region, chr6:~0.46 Mb (rs4959270 / rs1540771)",rs4959270 (also rs1540771),near IRF4,nearest_gene_only,"no Polyphen/SIFT scores tabulated; intergenic/intronic annotation only, P_adj not significant",P_adj=0.8959 / 0.9744,"Kalinago (Dominica); admixed ~55% Native American, ~32% Afri",IRF4
Ang2023,"OPRM1 region, chr6:~154.66-154.72 Mb (IPCEF1 rs2333857 / CNKSR3 rs6917661)",rs6917661 (representative); also rs2333857,IPCEF1 / CNKSR3 (near OPRM1),nearest_gene_only,intronic/upstream/3'UTR annotations only; no coding-effect prediction tabulated,P_adj=0.02938 (CNKSR3); 0.05976 (IPCEF1),"Kalinago (Dominica); admixed ~55% Native American, ~32% Afri",CNKSR3
Ang2023,"EGFR/LANCL2 region, chr7:~55.1-55.5 Mb (rs12668421 / rs11238349 / rs4948023)","rs12668421 (representative); also rs11238349, rs4948023",EGFR / LANCL2 (near EGFR),nearest_gene_only,"intronic annotations only, no coding-effect prediction tabulated; none reach genome-wide significance in Adhikari et al., 2019",P_adj=0.7809 / 0.542 / 0.7956,"Kalinago (Dominica); admixed ~55% Native American, ~32% Afri",EGFR
Ang2023,"EMX2 region, chr10:119564143 (rs11198112)",rs11198112,near EMX2 (intergenic),nearest_gene_only,"intergenic annotation only, no coding-effect prediction tabulated",P_adj=0.6206,"Kalinago (Dominica); admixed ~55% Native American, ~32% Afri",RAB11FIP2
Ang2023,"GRM5 (near TYR) region, chr11:88511524 (rs7118677)",rs7118677,GRM5 (near TYR),nearest_gene_only,"intronic annotation only, no coding-effect prediction tabulated",P_adj=0.000982,"Kalinago (Dominica); admixed ~55% Native American, ~32% Afri",GRM5
Ang2023,"SLC24A4 region, chr14:92773663 (rs12896399)",rs12896399,near SLC24A4 (intronic),nearest_gene_only,"intronic annotation only, no coding-effect prediction tabulated",P_adj=0.887,"Kalinago (Dominica); admixed ~55% Native American, ~32% Afri",SLC24A4
Ang2023,"ATRN region, chr20:3625436 (rs562926)",rs562926,ATRN (intronic/downstream),nearest_gene_only,"intronic/downstream annotation only, no coding-effect prediction tabulated",P_adj=0.1395,"Kalinago (Dominica); admixed ~55% Native American, ~32% Afri",
Morgan2018,"rs34357723 (MC1R-region regulatory signal, ~97 kb 5' of MC1R)",rs34357723,FANCA/SPIRE2 (nearest-gene label; functional target = MC1R regulation),nearest_gene_only,"the strongest signal of association in the region of MC1R (rs34357723...) does not originate from any observed amino acid changes, but is an SNP located some 97 kb from the 5' end of MC1R",2.25E-308,"UK Biobank; self-reported white British ancestry, genotype-c",SPIRE2
Morgan2018,rs6876712 (MSX2 / MSX2-LTO1 region),rs6876712,MSX2 (MSX2/LTO1 candidate),nearest_gene_only,5 MSX2 rs6876712 T 0.257 1.123 8.914 4.90E-19 intergenic 173976115 10 [PICS]... annotation=intergenic,4.90E-19,"UK Biobank; self-reported white British ancestry, genotype-c",MSX2
Morgan2018,rs9463733 (PKHD1 region),rs9463733,PKHD1,nearest_gene_only,OR=0.8683; z=-11.03; p=2.83E-28 (string); MAF=0.3195; annotation=Intron. epistatic interaction with MC1R V60L,2.83E-28,"UK Biobank; self-reported white British ancestry, genotype-c",PKHD1
Morgan2018,rs638640 (ORAOV1 region),rs638640,ORAOV1,nearest_gene_only,11 ORAOV1 rs638640 C 0.34 1.078 6.19 6.02E-10 intergenic 69387455... annotation=intergenic,6.02E-10,"UK Biobank; self-reported white British ancestry, genotype-c",CCND1
Morgan2018,"rs672948 (SIK1 region, chr21)",rs672948,SIK1,nearest_gene_only,"21 SIK1 rs672948 A 0.4145 1.07 5.729 1.01E-08 intergenic 44793448... this is a very marginal peak, but it is close to SIK1",1.01E-08,"UK Biobank; self-reported white British ancestry, genotype-c",SIK1
